{"canvas":{"height":896,"width":1460},"description":"Study identification and selection for fixture-new-mixed-sources, using databases, registers and other methods.","edges":[{"from":"db-identified","from_anchor":"right","id":"db-identification-to-removal","kind":"exclusion","label":null,"to":"db-removed","to_anchor":"left"},{"from":"db-identified","from_anchor":"bottom","id":"db-identification-to-screening","kind":"progression","label":null,"to":"db-screened","to_anchor":"top"},{"from":"db-screened","from_anchor":"right","id":"db-screening-to-record-exclusion","kind":"exclusion","label":null,"to":"db-records-excluded","to_anchor":"left"},{"from":"db-screened","from_anchor":"bottom","id":"db-screening-to-retrieval","kind":"progression","label":null,"to":"db-reports-sought","to_anchor":"top"},{"from":"db-reports-sought","from_anchor":"right","id":"db-retrieval-to-failure","kind":"exclusion","label":null,"to":"db-reports-not-retrieved","to_anchor":"left"},{"from":"db-reports-sought","from_anchor":"bottom","id":"db-retrieval-to-assessment","kind":"progression","label":null,"to":"db-reports-assessed","to_anchor":"top"},{"from":"db-reports-assessed","from_anchor":"right","id":"db-assessment-to-exclusion","kind":"exclusion","label":null,"to":"db-reports-excluded","to_anchor":"left"},{"from":"other-identified","from_anchor":"bottom","id":"other-identification-to-retrieval","kind":"progression","label":null,"to":"other-reports-sought","to_anchor":"top"},{"from":"other-reports-sought","from_anchor":"right","id":"other-retrieval-to-failure","kind":"exclusion","label":null,"to":"other-reports-not-retrieved","to_anchor":"left"},{"from":"other-reports-sought","from_anchor":"bottom","id":"other-retrieval-to-assessment","kind":"progression","label":null,"to":"other-reports-assessed","to_anchor":"top"},{"from":"other-reports-assessed","from_anchor":"right","id":"other-assessment-to-exclusion","kind":"exclusion","label":null,"to":"other-reports-excluded","to_anchor":"left"},{"from":"db-reports-assessed","from_anchor":"bottom","id":"db-assessment-to-included","kind":"merge","label":null,"to":"new-included","to_anchor":"top"},{"from":"other-reports-assessed","from_anchor":"bottom","id":"other-assessment-to-included","kind":"merge","label":null,"to":"new-included","to_anchor":"top"}],"nodes":[{"aria_label":"Records identified from:; Databases (n = 120); Registers (n = 30); Total (n = 150)","id":"db-identified","label":"Records identified from:\nDatabases (n = 120)\nRegisters (n = 30)\nTotal (n = 150)","lines":["Records identified from:","Databases (n = 120)","Registers (n = 30)","Total (n = 150)"],"rect":{"height":176,"width":300,"x":40,"y":40},"role":"source"},{"aria_label":"Records removed before screening:; Duplicate records (n = 20); Marked ineligible by automation (n = 5); Other reasons (n = 5); Total removed (n = 30)","id":"db-removed","label":"Records removed before screening:\nDuplicate records (n = 20)\nMarked ineligible by automation (n = 5)\nOther reasons (n = 5)\nTotal removed (n = 30)","lines":["Records removed before screening:","Duplicate records (n = 20)","Marked ineligible by automation","(n = 5)","Other reasons (n = 5)","Total removed (n = 30)"],"rect":{"height":176,"width":300,"x":400,"y":40},"role":"exclusion"},{"aria_label":"Records screened; (n = 120)","id":"db-screened","label":"Records screened\n(n = 120)","lines":["Records screened","(n = 120)"],"rect":{"height":92,"width":300,"x":40,"y":271},"role":"process"},{"aria_label":"Records excluded; (n = 70)","id":"db-records-excluded","label":"Records excluded\n(n = 70)","lines":["Records excluded","(n = 70)"],"rect":{"height":92,"width":300,"x":400,"y":271},"role":"exclusion"},{"aria_label":"Reports sought for retrieval; (n = 50)","id":"db-reports-sought","label":"Reports sought for retrieval\n(n = 50)","lines":["Reports sought for retrieval","(n = 50)"],"rect":{"height":96,"width":300,"x":40,"y":418},"role":"process"},{"aria_label":"Reports not retrieved; (n = 5)","id":"db-reports-not-retrieved","label":"Reports not retrieved\n(n = 5)","lines":["Reports not retrieved","(n = 5)"],"rect":{"height":96,"width":300,"x":400,"y":418},"role":"exclusion"},{"aria_label":"Reports assessed for eligibility; (n = 45)","id":"db-reports-assessed","label":"Reports assessed for eligibility\n(n = 45)","lines":["Reports assessed for eligibility","(n = 45)"],"rect":{"height":116,"width":300,"x":40,"y":569},"role":"process"},{"aria_label":"Reports excluded (n = 25):; Wrong population (n = 10)\nWrong intervention (n = 8)\nWrong study design (n = 7)","id":"db-reports-excluded","label":"Reports excluded (n = 25):\nWrong population (n = 10)\nWrong intervention (n = 8)\nWrong study design (n = 7)","lines":["Reports excluded (n = 25):","Wrong population (n = 10)","Wrong intervention (n = 8)","Wrong study design (n = 7)"],"rect":{"height":116,"width":300,"x":400,"y":569},"role":"exclusion"},{"aria_label":"Records identified from other methods:; Websites (n = 8); Organisations (n = 4); Citation searching (n = 6); Other sources (n = 2); Total (n = 20)","id":"other-identified","label":"Records identified from other methods:\nWebsites (n = 8)\nOrganisations (n = 4)\nCitation searching (n = 6)\nOther sources (n = 2)\nTotal (n = 20)","lines":["Records identified from other","methods:","Websites (n = 8)","Organisations (n = 4)","Citation searching (n = 6)","Other sources (n = 2)","Total (n = 20)"],"rect":{"height":176,"width":300,"x":760,"y":40},"role":"source"},{"aria_label":"Reports sought for retrieval; (n = 20)","id":"other-reports-sought","label":"Reports sought for retrieval\n(n = 20)","lines":["Reports sought for retrieval","(n = 20)"],"rect":{"height":92,"width":300,"x":760,"y":271},"role":"process"},{"aria_label":"Reports not retrieved; (n = 2)","id":"other-reports-not-retrieved","label":"Reports not retrieved\n(n = 2)","lines":["Reports not retrieved","(n = 2)"],"rect":{"height":92,"width":300,"x":1120,"y":271},"role":"exclusion"},{"aria_label":"Reports assessed for eligibility; (n = 18)","id":"other-reports-assessed","label":"Reports assessed for eligibility\n(n = 18)","lines":["Reports assessed for eligibility","(n = 18)"],"rect":{"height":96,"width":300,"x":760,"y":418},"role":"process"},{"aria_label":"Reports excluded (n = 8):; Duplicate report (n = 5)\nInsufficient information (n = 3)","id":"other-reports-excluded","label":"Reports excluded (n = 8):\nDuplicate report (n = 5)\nInsufficient information (n = 3)","lines":["Reports excluded (n = 8):","Duplicate report (n = 5)","Insufficient information (n = 3)"],"rect":{"height":96,"width":300,"x":1120,"y":418},"role":"exclusion"},{"aria_label":"Studies included in review; (n = 24); Reports of included studies; (n = 30)","id":"new-included","label":"Studies included in review\n(n = 24)\nReports of included studies\n(n = 30)","lines":["Studies included in review","(n = 24)","Reports of included studies","(n = 30)"],"rect":{"height":116,"width":660,"x":400,"y":740},"role":"outcome"}],"reading_order":["db-identified","db-removed","other-identified","db-screened","db-records-excluded","other-reports-sought","other-reports-not-retrieved","db-reports-sought","db-reports-not-retrieved","other-reports-assessed","other-reports-excluded","db-reports-assessed","db-reports-excluded","new-included"],"recipe_id":"org.prisma/prisma-2020/new-databases-registers-other-sources","schema_version":"dev.standardflow.scene-graph.v1","text_equivalent":"PRISMA 2020 flow diagram: new review with other sources\n\nStudy identification and selection for fixture-new-mixed-sources, using databases, registers and other methods.\n\n1. Records identified from:\nDatabases (n = 120)\nRegisters (n = 30)\nTotal (n = 150)\n2. Records removed before screening:\nDuplicate records (n = 20)\nMarked ineligible by automation (n = 5)\nOther reasons (n = 5)\nTotal removed (n = 30)\n3. Records identified from other methods:\nWebsites (n = 8)\nOrganisations (n = 4)\nCitation searching (n = 6)\nOther sources (n = 2)\nTotal (n = 20)\n4. Records screened\n(n = 120)\n5. Records excluded\n(n = 70)\n6. Reports sought for retrieval\n(n = 20)\n7. Reports not retrieved\n(n = 2)\n8. Reports sought for retrieval\n(n = 50)\n9. Reports not retrieved\n(n = 5)\n10. Reports assessed for eligibility\n(n = 18)\n11. Reports excluded (n = 8):\nDuplicate report (n = 5)\nInsufficient information (n = 3)\n12. Reports assessed for eligibility\n(n = 45)\n13. Reports excluded (n = 25):\nWrong population (n = 10)\nWrong intervention (n = 8)\nWrong study design (n = 7)\n14. Studies included in review\n(n = 24)\nReports of included studies\n(n = 30)\n","title":"PRISMA 2020 flow diagram: new review with other sources"}
